{"authority_digest":"0000000000000000000000000000000000000000000000000000000000000010","components":[{"bytes":0,"content_digest":"0000000000000000000000000000000000000000000000000000000000000040","descriptor_digest":"0000000000000000000000000000000000000000000000000000000000000041","files":0,"identity":{"fs_magic":"tmpfs","gid":1000,"mode":493,"mount_id":1,"path":"retention/d-0","role":"D","root_id":1,"type":"directory","uid":1000},"path":"retention/d-0","role":"D"},{"bytes":64,"content_digest":"0000000000000000000000000000000000000000000000000000000000000042","descriptor_digest":"0000000000000000000000000000000000000000000000000000000000000043","files":1,"identity":{"fs_magic":"tmpfs","gid":1000,"mode":384,"mount_id":1,"path":"retention/marker","role":"M","root_id":1,"type":"regular","uid":1000},"path":"retention/marker","role":"M"},{"bytes":64,"content_digest":"0000000000000000000000000000000000000000000000000000000000000044","descriptor_digest":"0000000000000000000000000000000000000000000000000000000000000045","files":1,"identity":{"fs_magic":"tmpfs","gid":1000,"mode":384,"mount_id":1,"path":"retention/relation","role":"R","root_id":1,"type":"regular","uid":1000},"path":"retention/relation","role":"R"},{"bytes":128,"content_digest":"0000000000000000000000000000000000000000000000000000000000000046","descriptor_digest":"0000000000000000000000000000000000000000000000000000000000000047","files":1,"identity":{"fs_magic":"tmpfs","gid":1000,"mode":384,"mount_id":1,"path":"retention/accounted","role":"P","root_id":1,"type":"regular","uid":1000},"path":"retention/accounted","role":"P"},{"bytes":128,"content_digest":"0000000000000000000000000000000000000000000000000000000000000048","descriptor_digest":"0000000000000000000000000000000000000000000000000000000000000049","files":1,"identity":{"fs_magic":"tmpfs","gid":1000,"mode":384,"mount_id":1,"path":"retention/handoff","role":"H","root_id":1,"type":"regular","uid":1000},"path":"retention/handoff","role":"H"}],"generation":1,"intent_digest":"0000000000000000000000000000000000000000000000000000000000000020","kind":"envelope","output_digest":"0000000000000000000000000000000000000000000000000000000000000017","profile_digest":"0000000000000000000000000000000000000000000000000000000000000031","release_id":"release-0.2.1","release_schema_digest":"0000000000000000000000000000000000000000000000000000000000000032","reservation_id":"reservation-1","schema":"kilix.content.retention/v1","stable_slot_digest":"0000000000000000000000000000000000000000000000000000000000000033","target_roles":["D","M","R","P","H"],"version":1}
